{
  "normRef": { "doc": "Реестр нормативных документов", "clause": "раздел 8.1 промпта ночного прогона" },
  "verification": "CuratorExtracted",
  "markers": ["GOST-011", "GOST-015", "GOST-018"],
  "sources": [
    {
      "id": "GOST_R_52290_2024",
      "doc": "ГОСТ Р 52290-2024",
      "title": "Технические средства организации дорожного движения. Знаки дорожные. Общие технические требования",
      "approvedBy": "приказ Росстандарта от 25.12.2024 № 2001-ст",
      "effectiveFrom": "2026-01-01",
      "replaces": "ГОСТ Р 52290-2004",
      "usedFor": ["профиль типоразмеров I–IV", "табл. Д.1–Д.9", "каймы", "номенклатура POC-знаков"],
      "verification": "CuratorExtracted"
    },
    {
      "id": "GOST_R_52289_2019_AMD1",
      "doc": "Изменение № 1 к ГОСТ Р 52289-2019",
      "title": "Правила применения дорожных знаков, разметки, светофоров, дорожных ограждений и направляющих устройств",
      "approvedBy": "приказ Росстандарта от 25.12.2024 № 2000-ст",
      "effectiveFrom": null,
      "replaces": null,
      "usedFor": ["правила применения знаков (R003, зоны действия) — значения не извлекались"],
      "verification": "CuratorExtracted"
    },
    {
      "id": "MINTRANS_49",
      "doc": "Приказ Минтранса России от 18.02.2025 № 49",
      "title": "Об установлении требований к составу и содержанию документации по организации дорожного движения",
      "approvedBy": "зарегистрирован Минюстом 28.02.2025 № 81406, действует с 11.03.2025",
      "effectiveFrom": "2025-03-11",
      "replaces": null,
      "usedFor": ["в составе ПОДД есть спецификации и перечни ТСОДД — наша ведомость"],
      "verification": "CuratorExtracted"
    },
    {
      "id": "GOST_32945_2014",
      "doc": "ГОСТ 32945-2014",
      "title": "Дороги автомобильные общего пользования. Знаки дорожные. Технические требования",
      "approvedBy": "приказ Росстандарта от 31.08.2016 № 991-ст",
      "effectiveFrom": null,
      "replaces": null,
      "usedFor": ["второй профиль типоразмеров 1–5, прил. А, табл. А.1–А.4 (п. 4.4.3)"],
      "verification": "CuratorExtracted"
    }
  ]
}
